1,刻晴,抵天雷罚,1,本回合内，无元素队友攻击造成雷元素伤害,0,1
2,刻晴,天街巡游,0,对目标造成2点雷元素伤害，随后对所有敌人随机造成5次1点雷元素伤害,3,1
3,芭芭拉,演唱开始,1,为目标[恢复]5点HP,0,1
4,芭芭拉,闪耀奇迹,0,全体队友[恢复]4点HP,2,1
5,Boss,王的拳击,0,冰丘丘王对目标进行一次拳击，造成<color=#51d099>1</color>点物理伤害。冰丘丘王处于狂暴状态时，该伤害变为冰属性伤害。冷却时间<color=#51d099>1</color>回合。,1,2
6,Boss,王的捶地,0,冰丘丘王对全场进行一次震击，成<color=#51d099>1</color>点冰元素范围伤害。处于狂暴状态时，为全场施加攻击力降低<color=#51d099>1</color>点的冰元素debuff，持续三回合，同时失去<color=#51d099>2</color>点冰霜护甲。冷却时间4回合,2,2
7,Boss,疯狂的丘丘人,2,冰丘丘王作为丘丘人中的王者，身体中蕴含着巨大的潜能，生命值每降低25%，为自身生成20点冰元素护盾，当该护盾存在时，丘丘王进入狂暴状态。,0,2
8,Boss,丘丘野兽,2,杜林的腐化让冰丘丘王化身野兽，冰丘丘王每失去25%的血量，所有技能伤害增加1点。,0,2